,company,job title,location,job description,salary estimate,company_size,company_type,company_sector,company_industry,company_founded,company_revenue,rating
0,"Publicis Sapient
3.7",Data Scientist - Senior Manager (H/F),Paris,"Company Description

As a digital business transformation partner, we’ve spent nearly three decades utilizing the disruptive power of technology and ingenuity to help digitally enable our clients' business in their pursuit of next. Always through radical customer centricity and an outside-in mindset. We’ve built a history of digital firsts…
we helped a bank launch the world’s first Internet Banking Offering
enabled an Airline to become the first to allow online check-in and seat selection
launched the first online share Trading Platform
created the first secure transaction for money online
We bring a startup mindset and agile methods to both established companies and the public sector to unlock value in ways that delight their customers and improve their operational effectiveness. Our approach to transformation is built from outside-in, challenging conventions and uniquely fusing of strategy and consulting, experience, data science and engineering with an enduring culture of creative problem-solving.",€39K - €47K (Employer est.),10000+ Employees,Company - Public,Management & Consulting,Business Consulting,1990,Unknown / Non-Applicable,3.7
1,"TotalEnergies
3.9",Data Scientist IA débutant F/H - Prédiction des ressources en métaux dans les eaux souterraines par Intelligence Artificielle,Pau,"Systèmes d'Information, Recherche Innovation&Développt
PAU-CSTJF(FRA)
France
Description du poste
Vous êtes jeune diplômé(e) ?
Débutez votre carrière par une expérience stimulante au cœur d’équipes internationales, engagées dans la transition énergétique !
Nous recherchons pour une durée de 12 mois au CSTJF à PAU (64), un Data Scientist débutant H/F, pour travailler sur la Prédiction des ressources en métaux dans les eaux souterraines par Intelligence Artificielle.
Nous vous proposons un Contrat de Professionnalisation Temps Plein qualifiant de 12 mois (100% en entreprise) incluant 15% de formation interne (métier, linguistique, outils…) dispensée par des organismes sélectionnés par TotalEnergies.
Ce contrat vous permettra d’acquérir une année d’expérience professionnelle tout en étant formé aux spécificités de votre métier en lien avec les activités de la Compagnie. Un réel atout pour booster votre employabilité !

Pour en savoir plus : https://www.cstjf-pau.total/fr",€39K - €47K (Employer est.),10000+ Employees,Company - Public,"Energy, Mining & Utilities",Energy & Utilities,1924,$25 to $100 million (USD),3.9
2,"GROUPE LIMAGRAIN
4.1",Data Analyst (H/F),Saint-Beauzire,"Famille de métier
FONCTIONS SUPPORT - SI
Type de contrat
CDI
Finalité du poste
Le projet ?
Au sein de Limagrain IT, vous pilotez et traitez les sujets liés au décisionnel (création et alimentation de datawarehouses et de la couche sémantique associée, production de rapports, de dashboards, d'indicateurs de pilotage et de suivi, création de datasets métiers,…) depuis le recueil des besoins jusqu'à leur délivrance en passant par les phases d'analyse, chiffrage, réalisation, lancement et conduite du changement.",€39K - €47K (Employer est.),5001 to 10000 Employees,Company - Private,Agriculture,Crop Production,1965,$1 to $5 billion (USD),4.1
3,"Matmut
3.2",Data scientist F/H,Rouen,"Le Groupe Matmut recherche de nouveaux talents pour accompagner sa transformation et son développement avec engagement et ambition, tout en conservant son ADN.

Confiant et bienveillant envers ses salariés, il construit avec eux des parcours professionnels motivants. Convaincu que la diversité des potentiels est une richesse, il accompagne, forme et fait grandir tous les talents.

Nous recherchons un Data Scientist afin de valoriser les données de nos sociétaires et prospects à des fins marketing.

Rattaché(e) à la Direction Marketing Groupe, vous intégrerez la team data science d'un pôle comprenant des data analysts, data scientists et web analysts.

Dans ce cadre, vous serez amené(e) à :",€39K - €47K (Employer est.),1001 to 5000 Employees,Company - Private,Insurance,Insurance Agencies & Brokerages,1961,Unknown / Non-Applicable,3.2
4,"Inetum
3.4",Data Analyst H/F,Lille,"Mission
Dans le cadre de la croissance de notre agence lilloise, nous développons notre Practice Data et recrutons des profils Data de divers horizons : Data Analyst, Data Engineer, Data Scientist et Data Gouv. Les besoins métiers de nos clients et la multitude des technologies font qu'il nous faut nous appuyer sur une diversité de compétences. Vous pourriez être l’un d’eux et rejoindre Inetum.

En tant que Data Analyst, vos principales missions consistent à :
Analyser et retranscrire le besoin client
Identifier, extraire et exploiter les sources d'acquisition de données les plus pertinentes",€39K - €47K (Employer est.),10000+ Employees,Company - Private,Information Technology,Information Technology Support Services,1970,$1 to $5 billion (USD),3.4
5,"Damart
3.8",Data analyst junior - H/F,Roubaix,"Né en 1953 d'une innovation - l'iconique Thermolactyl - Damart, est une grande marque patrimoniale française, l'une des rares à être entrée dans le langage commun: ""il fait froid, mets ton Damart!"". Notre leadership sur le marché des séniors, en plein essor, est fondé sur une double expertise: le textile intelligent, source de bien-être pour toute les générations et le prêt-à-porter, dédié aux femmes de 55 ans et plus qui recherchent le style et le confort.
Pour séduire les nouvelles générations et conquérir nos clients de demain, nos 1000 collaborateurs en France réinventent chaque jour Damart et accélèrent sa transformation: innovation textile, nouveau style et nouvelle image, transition digitale pour une shopping expérience omnicanale, conquête de nouveaux marchés à l'international ...
Implantée en France, Belgique, Angleterre et Suisse, Damart poursuit aujourd'hui son développement à l'international: Après le Japon et les USA, la marque s'implante en Espagne, Italie, Australie, Liban, Chypre...",€39K - €47K (Employer est.),501 to 1000 Employees,Unknown,Manufacturing,Consumer Product Manufacturing,-1,$100 to $500 million (USD),3.8
6,"Onera
4.3",CHERCHEUR EN SCIENCE DES DONNEES POUR L’AERODYNAMIQUE H/F,Bordeaux,"Présentation ONERA
L’ONERA, acteur central de la recherche aéronautique et spatiale, emploie plus de 2000 personnes. Placé sous la tutelle du ministère des Armées, il dispose d’un budget de 266 millions d’euros (2022), dont plus de la moitié provient de contrats d'études, de recherche et d'essais. Expert étatique, l’ONERA prépare la défense de demain, répond aux enjeux aéronautiques et spatiaux du futur, et contribue à la compétitivité de l’industrie aérospatiale. Il maîtrise toutes les disciplines et technologies du domaine. Tous les grands programmes aérospatiaux civils et militaires en France et en Europe portent une part de l’ADN de l’ONERA : Ariane, Airbus, Falcon, Rafale, missiles, hélicoptères, moteurs, radars… Reconnus à l’international et souvent primés, ses chercheurs forment de nombreux doctorants.
Présentation du département
Le Département Aérodynamique, Aéroélasticité, Acoustique, DAAA de l’ONERA, a pour mission de préparer au profit de l’industrie des réponses technologiques pour améliorer les performances Aérodynamique, Aéroélastique et Acoustique des aéronefs, et répondre aux enjeux de compétitivité, aux besoins sociétaux, environnementaux et de défense.

Missions
Profil",€39K - €47K (Employer est.),1001 to 5000 Employees,Company - Public,Aerospace & Defense,Aerospace & Defense,1946,$100 to $500 million (USD),4.3
7,innovation e-Santé Sud ieSS,Data Scientist H/F,Hyères,"Le GIP Innovation e-Santé Sud (ieSS) est un Groupement Régional d’Appui au Développement de la e-Santé (GRADeS).
ieSS agit pour la réussite du déploiement des politiques nationales et régionales de la e-santé en région PACA.
Plate-forme servicielle e-santé de proximité régionale, ieSS a engagé une dynamique de transformation de service auprès de ses membres clients en veillant à :
Proposer des services permettant de concilier l'efficience, la qualité des soins et la satisfaction des professionnels et usagers ;
Contribuer à l amélioration de l offre et de la coordination de soins et à élargir le champ du parcours de soins (prévention, information, soins, accompagnement) ;
Améliorer la prévention et le suivi des patients par l exploitation des données collectées ;",€39K - €47K (Employer est.),-1,-1,-1,-1,-1,-1,-1
8,"CS GROUP
3.6",Chef de projet / Coordinateur Data Science - F/H,Toulouse,"Description de l'entreprise

La mission de CS GROUP : être à la pointe des technologies pour garantir la sécurité de tous dans un monde en pleine mutation. L’expertise reconnue du groupe lui permet d’intervenir là où les enjeux sont les plus critiques : aéronautique, défense, énergie, spatial. Et, aussi, là où les réponses sont à inventer ou à réinventer : lutte anti-drones, cybersécurité…
Notre esprit Tech et pragmatique, ainsi que notre agilité d’ETI nous permettent d’allier proximité, engagement et innovation, pour diffuser notre culture à tous les niveaux : dans la relation client, dans le mode de management interne, dans notre engagement social et environnemental…
Et bien sûr, dans le développement de votre carrière, notre ambition est de faire de vous un collaborateur accompli : formations, revue de carrière, mobilité, programme ambassadeur…",€39K - €47K (Employer est.),1001 to 5000 Employees,Company - Private,Information Technology,Information Technology Support Services,1968,$100 to $500 million (USD),3.6
9,"Inetum
3.4",Data Analyst SAS / Hadoop H/F,Brest,"Mission
En recherche d’un nouveau challenge en tant que Data Analyst Sas / Hadoop ?

Au sein d’une équipe Inetum, vous intervenez chez un client reconnu dans le domaine bancaire à Brest, sur des projets structurants.
La mission consiste à:
La création de requêtes SAS ou Hadoop pour les différents services du client,
L’extraction réalisée directement sur le host de production afin d’obtenir les données les plus récentes possibles,",€39K - €47K (Employer est.),10000+ Employees,Company - Private,Information Technology,Information Technology Support Services,1970,$1 to $5 billion (USD),3.4
10,"Inetum
3.4",Data Analyst Industrie 4.0 H/F,Toulouse,"Mission
Notre équipe Data accompagne essentiellement des industriels et des grands comptes dans la collecte, le traitement et la valorisation de leurs données usine en France et en Europe.
A ce titre votre poste consistera à :
Piloter la gestion, la gouvernance et la généalogie des données de production
Participer à l'enrichissement de l'entrepôt de données
Contribuer à l’extraction, au raffinage et à la qualification des données pour les besoins statistiques ou analytiques,
Développer et Améliorer les algorithmes d’analyse et de traitement de données,",€39K - €47K (Employer est.),10000+ Employees,Company - Private,Information Technology,Information Technology Support Services,1970,$1 to $5 billion (USD),3.4
11,"LIMAGRAIN EUROPE SAS
4.1",Analyste de données en sélection Maïs (H/F),Ennezat,"Famille de métier
RECHERCHE ET INNOVATION - SELECTION VARIETALE
Type de contrat
CDD
Durée du contrat
12 mois
Temps de travail",€39K - €47K (Employer est.),5001 to 10000 Employees,Company - Private,Agriculture,Crop Production,1965,$1 to $5 billion (USD),4.1
12,"Atmosphères
3.3",Data Analyst H/F,Bois-d'Arcy,"Atmosphères est l'une des agences marketing terrain experte dans le domaine de l'High Tech qui permet à ses clients de faire de leurs idées, une réalité ! ✨
Grâce à des prestations clés en main, sur-mesure, innovantes et personnalisables, nous accompagnons nos clients dans le développement de leur image de marque et la dynamisation des ventes, de manière à accroître leur visibilité et atteindre leurs objectifs au sein des différents points de vente partenaires, et ce, dans toute la France !
La Team Atmo a plus d'un tour dans son sac et nous pouvons proposer à nos clients des solutions aussi bien au niveau de la Force de Vente, Force de Formation, de l'Animation, et aussi des commandos Merchandising. Nous ne nous arrêtons pas à notre expertise High Tech ! Nous proposons également nos services à des marques de différents secteurs: jeux vidéo, jouets, bricolage, textile...
Notre équipe ne se repose pas sur ses acquis et tente chaque jour d'innover, de trouver des nouvelles idées et concepts créatifs afin de faire face à l'évolution du marché sans jamais oublier de mette le côté humain et la bonne humeur au coeur de notre stratégie !",€39K - €47K (Employer est.),51 to 200 Employees,Company - Private,Human Resources & Staffing,HR Consulting,2002,$5 to $25 million (USD),3.3
13,"TOYOTA MATERIAL HANDLING FRANCE
2.5",Data Analyst CRM,Bussy-Saint-Georges,"Toyota Material Handling France, filiale du groupe TMHE (Toyota Material Handling Europe), constructeur de chariots élévateurs et spécialiste de la manutention interne depuis 1946, propose une gamme étendue de produits ainsi que des services performants, qui permettent de répondre à tous types de demande.
L’entreprise et ses 1000 collaborateurs répartis sur l'ensemble du territoire partagent des valeurs fortes qui favorisent le travail d’équipe, l’amélioration continue, la recherche de solutions consensuelles, le respect et le challenge.
Dans le cadre d’un remplacement, nous recherchons un Data Analyst CRM F /H localisé au siège de Bussy Saint Georges.
Rattaché(e) à la Direction Marketing et plus précisément au service Développement et Connaissance Client, vous administrez et assurez le fonctionnement et l’exploitation des bases de données utilisées par la Direction Commerciale. Vous êtes garant de l’intégrité, la mise à disposition et la fiabilité des bases de données notamment celles provenant du CRM. Véritable référent sur ces sujets, vous travaillez de façon transverse au développement de la culture « data » dans l’entreprise et aux opportunités business qu’elle offre.",€39K - €47K (Employer est.),201 to 500 Employees,Company - Private,"Construction, Repair & Maintenance Services",Commercial Equipment Services,1967,Unknown / Non-Applicable,2.5
14,"Damart
3.8",Data analyst senior - H/F,Roubaix,"Né en 1953 d'une innovation - l'iconique Thermolactyl - Damart, est une grande marque patrimoniale française, l'une des rares à être entrée dans le langage commun: ""il fait froid, mets ton Damart!"". Notre leadership sur le marché des séniors, en plein essor, est fondé sur une double expertise: le textile intelligent, source de bien-être pour toute les générations et le prêt-à-porter, dédié aux femmes de 55 ans et plus qui recherchent le style et le confort.
Pour séduire les nouvelles générations et conquérir nos clients de demain, nos 1000 collaborateurs en France réinventent chaque jour Damart et accélèrent sa transformation: innovation textile, nouveau style et nouvelle image, transition digitale pour une shopping expérience omnicanale, conquête de nouveaux marchés à l'international ...
Implantée en France, Belgique, Angleterre et Suisse, Damart poursuit aujourd'hui son développement à l'international: Après le Japon et les USA, la marque s'implante en Espagne, Italie, Australie, Liban, Chypre...",€39K - €47K (Employer est.),501 to 1000 Employees,Unknown,Manufacturing,Consumer Product Manufacturing,-1,$100 to $500 million (USD),3.8
15,"CGI FINANCE
3.5",Data Scientist H/F,France,"Au sein de l’équipe Etudes & Stratégies, nous recherchons actuellement un(e) Data Scientist qui aura pour principales missions de :
Créer, calibrer et backtester des modèles prédictifs dans les différentes sphères d’activité de l’entreprise et notamment la gestion des risques (score d’octroi, fraude, etc.) mais aussi marketing (fidélisation, parcours client, etc.)
Tester dans ce cadre l’apport des méthodologies alternatives de type Machine Learning (benchmark avec les méthodologies classiques, interprétabilité, etc.)
Accompagner les utilisateurs de ces modèles dans l’identification du besoin, la compréhension et l’appropriation des solutions proposées
Participer à l’intégration des modèles dans les outils existants (études d’impact, simulations, etc.)
Documenter les modèles et participer aux travaux de validation auprès des instances de supervision",€39K - €47K (Employer est.),1001 to 5000 Employees,Company - Private,Financial Services,Banking & Lending,1951,$1 to $5 billion (USD),3.5
16,"L2C
4.0",Data Analyst - Editeur de logiciels Big data leader sur son domaine - Fxie + bonus déplafonné - H/F,Paris,"Sql / Talend
Data Engineer, Big Data Analyst, Data Analyst / CDI / Environ 65k€ / 7+ / Paris

Le poste
Créé il y a 8 ans, notre client est un éditeur de logiciels SAAS spécialisé dans la préparation et le traitement de données, pionnier dans les logiciels de data preparation no code et souverains. En phase active de croissance, cette société composée d’une quinzaine d’experts se positionne comme un véritable partenaire data auprès des acteurs publics, des grands comptes ou encore des ETI, en leur permettant de traiter et de valoriser leurs données de façon rapide et sécurisée. Spécialisée dans le big data, l’IA et le machine learning, notre client ambitionne de devenir l’un des leaders du secteur, en rendant les données fiables, accessibles et pertinentes. Ces solutions SAAS s’adaptent facilement aux infrastructures, rendant ainsi les équipes & projets data facilement autonomes. Vous interviendrez dans un environnement technologique de pointe, sur un projet ambitieux.",€39K - €47K (Employer est.),10000+ Employees,Company - Public,Management & Consulting,Research & Development,1968,$1 to $5 billion (USD),4.0
17,Peroptyx,Analyste de données H/F,Paris,"Vous recherchez un horaire de travail flexible ? Un deuxième revenu peut-être ou une expérience enrichissante pour lancer votre carrière ??
Chez Peroptyx, vous pouvez planifier vos journées en fonction d'un horaire de travail très flexible, travailler le week-end ou tard le soir depuis votre bureau à domicile. La flexibilité de nos postes minimise l'impact sur votre routine quotidienne..
Que vous soyez un étudiant cherchant à gagner sa vie tout en apprenant, un retraité à la recherche d'un nouveau défi, un professionnel à temps partiel ou un parent travaillant à domicile, Peroptyx a le poste qu'il vous faut !!
Depuisdes milliers d'années, les cartes fournissent aux humains les connaissancesdont ils ont besoin pour prendre des décisions. En tant qu'évaluateur decartes, vous aurez l'occasion de fournir la vérité du terrain pour votre villeou votre pays.",€39K - €47K (Employer est.),1 to 50 Employees,Company - Private,Information Technology,Internet & Web Services,2018,Unknown / Non-Applicable,-1
18,"Teleperformance Portugal
4.2",Data analyst campagne publicitaire Pinterest à Lisbonne (f/h/x),France,"Vous êtes francophone, passionné par le marketing digital et avez un esprit analytique ? Travaillez avec Pinterest et lancez-vous dans ce nouveau défi !
En tant qu’analyste publicitaire, votre rôle sera d'analyser les données des campagnes marketing numérique de notre client dans le but d’optimiser leur profit.
Vous travaillerez sur le marché français et contribuerez à créer une meilleure expérience pour les utilisateurs. Êtes-vous prêt ?
Notre Client
Pinterest constitue le meilleur moteur de recherche visuelle dans le monde utilisé par plus de 300 millions de personnes. C'est une plateforme de partage d'idées et de créativité et aussi, l'endroit idéal pour trouver les produits et les marques les plus innovants, trouver l'inspiration et rêver.
Responsabilité",€39K - €47K (Employer est.),10000+ Employees,Company - Private,Telecommunications,Telecommunications Services,1978,$100 to $500 million (USD),4.2
19,"Procter & Gamble
4.2",Data Analyst,Paris,"Job Location Paris

Job Description
Are you energized by solving tough business problems?
Do you have a passion to transform P&G's brand building while enabling better decision-making with cutting (e.g.
ranging from Data Science to Behavioral Science)?
If so, then a role in the Analytics and Insights organization is for you!
The Analytics & Insights career in P&G takes you across a breadth of experiences, on multiple P&G businesses,
likely in multiple countries, always with an international perspective, always fast-paced.
It is a unique opportunity to develop both the ever-more demanded Data Science skillset and the strategic
thinking needed to manage P&G business.
The most distinguishing traits of whom we hire in A&I are curiosity and mental agility to relentlessly learn more (esp. about business, but equally also psychology, mathematics, and coding): all we need is an eagerness to learn,
the rest we will develop, as we grow our talents from within.


Earn the role of trusted advisor to the Business Unit Leadership Team

Deliver regular insights, by using advanced analytics techniques, mining extremely large data sets (the hyped Big Data), and applying best-in-class algorithms developed with/by other Data Scientists, examples could be building models to propose possible scenarios and answer the toughest business questions of the leadership team, optimize algorithms in accuracy and performance to then recommend specific actions to your business partners, discover unknown truths by mining new data sets;

Develop closed-loop experimentation capabilities, to test and learn about key business questions;

Lead and improve the analytical program of your business unit, together with the other functions: design the data strategy for the business unit adopt the right platform and big data technologies.
Grow the organization’s knowledge and skills in the space of Data & Analytics:

Take from proof of concept to scaled capabilities the best innovative algorithms from your colleagues and operationalize best-in-class Data-science practice (e.g. cross validation and target shuffling) to all key models and algorithms;

Collaborate in a multi-functional team.
So, here’s your opportunity! Join Analytics & Insights and help us anticipate what consumers want and find out what they need.

Job Qualifications


Studying towards MSc in a quantitative field, e.g. Engineering, Data Science, Statistics, Computer Science, Physical Sciences or Quantitative Social Science;

Ability to handle multiple priorities and you have either an entrepreneur or consultancy mindset and passion for business while technically (data) savvy;

Work experience or certification in SQL, Python and/or R;

Strong analytical skills, using multiple data sources, with the ability to query and analyze data;

Creativity, Innovation, Initiative, Follow-Through, Strong written and verbal communication;

Experience from school/work that demonstrates strong leadership through envisioning, direction setting, enrolling others and thinking/problem solving.


27 paid vacation days

13 RTT (out of which 5 are collective ones)

3 bridge days offered by the company

Profit sharing

Company saving plan with company contribution

Health mutual and insurance

Company support for 50% on public transports costs in Paris area or eco mobility support (eg. bike)

Tickets Restaurant card by Edenred (optional)

Company restaurant

Work from Home (2 to 3 days/week, depending on the job)

Conciergerie services on site

Gym room on site for free

Work Council offers & subsidies

Xmas hamper

Coupons on our P&G products
ARE YOU EXCITED ABOUT THE ROLE? DEEP DIVE INTO P&G AND CHECK THE BELOW INSIGHTFUL LINKS:

1) application, 2) online assessments and 3) interviews. Click here to get all the tips to be fully prepared.

P&G is driven to make life better, not just within the company, but across the globe. Click here to check out how we make a meaningful impact on the world .

We are the world’s largest consumer goods company. Click here to discover about our iconic brands .
Encouraging diversity in all its forms, P&G is committed to creating an inclusive work environment and promotes equal opportunities.

Job Schedule Full time

Job Number R000076000

Job Segmentation Recent Grads/Entry Level (Job Segmentation)",€39K - €47K (Employer est.),10000+ Employees,Company - Public,Manufacturing,Consumer Product Manufacturing,1837,$10+ billion (USD),4.2
