,company,job title,location,job description,salary estimate,company_size,company_type,company_sector,company_industry,company_founded,company_revenue,rating
127,"Thales
4.0",Ingénieur Data Analyst F/H,Lille,"QUI SOMMES-NOUS ?
Thales propose des systèmes d’information et de communication sécurisés et interopérables pour les forces armées, les forces de sécurité et les opérateurs d’importance vitale. Ces activités, qui regroupent radiocommunications, réseaux, systèmes de protection, systèmes d’information critiques et cybersécurité, répondent aux besoins de marchés où l’utilisation des nouvelles technologies numériques est déterminante. Thales intervient tout au long de la chaîne de valeur, des équipements aux systèmes en passant par le soutien logistique et les services associés.
Le site de Lambersart est largement dédié aux activités de Soutien & Services Clients Opérations. Il abrite également les activités d’ingénierie et intégration des réseaux stratégiques, et de développement logiciel. Il développe et maintient des solutions de réseaux stratégiques, et réalise les activités de soutien et de service client pour l’ensemble des solutions livrées de systèmes d’information et de communications sécurisées.














Le poste pouvant nécessiter d'accéder à des informations relevant du secret de la défense nationale, la personne retenue fera l'objet d'une procédure d’habilitation, conformément aux dispositions des articles R.2311-1 et suivants du Code de la défense et de l’IGI 1300 SGDSN/PSE du 09 août 2021.
Innovation, passion, ambition : rejoignez Thales et créez le monde de demain, dès aujourd’hui.",€45K - €65K (Employer est.),1001 to 5000 Employees,Company - Public,Aerospace & Defense,Aerospace & Defense,2000,$1 to $5 billion (USD),4.0
128,"CGI FINANCE
3.5",Product Data Analyst Senior,Lille,"Au sein de la Direction Data Intelligence, nous recherchons actuellement un(e) Product Data Analyst senior.
Ce poste clé aura pour mission de nourrir la stratégie de développement de CGI Finance grâce à une démarche Data Centric en assurant les missions suivantes :
Comprendre les enjeux business des principaux métiers de CGI Finance (Financement automobile B2B2C et Digital, Financement Bateau, Rachat de crédit, Recouvrement, risque de crédit)
Participer à l’écriture des User Story et fonctionnalités attendues sur la road Map Data
Définir les KPIs et métriques à suivre pour chaque fonctionnalités
Rechercher et analyser les données nécessaires dans le SI en collaboration avec les sachants métiers/ Data afin de constituer les Data Pool / Data Mart nécessaires
Réaliser les spécifications éventuelles pour faire évoluer le SI afin de collecter/calculer les données nécessaires",€45K - €65K (Employer est.),1001 to 5000 Employees,Company - Private,Financial Services,Banking & Lending,1951,$1 to $5 billion (USD),3.5
129,"APRIL
3.7",Data Scientist,Lyon,"Véritable industrie de la donnée, rejoignez le monde de l’assurance et mettez votre expertise au service de la valorisation de notre patrimoine informationnel !

Votre objectif : éclairer et objectiver les prises de décisions des différentes parties prenantes de l'entreprise.

Et si être « Data Scientist » chez APRIL vous permettait …- de choisir un métier dont vous pourrez être fier : «accompagner et protéger à chaque moment qui compte, simplement» telle est la mission et la raison d’être partagée par l’ensemble de nos collaborateurs,
de développer votre expertise dans un environnement en pleine transformation, au carrefour de l’innovation et de l’expérience client : notre ambition à horizon 2023, être un acteur digital, omnicanal et agile, champion de l'expérience client,
de vous engager au sein d'une entreprise engagée : nous rejoindre, c’est faire partie d’un Groupe responsable qui agit en entreprise citoyenne en étant mobilisé autour de 4 axes (santé, aidants, éducation et environnement) avec un impact sociétal positif et réel.
Nous nous engageons à promouvoir des emplois respectant la diversité et la différence, ouverts à chacun.


Gestion des données et support à la décision

Veille et développement de l'activité

Cette opportunité est à pourvoir dans le cadre d'une création de poste

Directement rattaché.e à Nicolas , Directeur de la distribution directe, vous rejoindrez l'équipe DIAG (Data Innovation & Analytics group) basée à Lyon.

Dès votre arrivée, vous bénéficierez d'un parcours d'intégration pour favoriser votre prise de poste.

Vous disposez au minimum d'un Bac +3en statistique et traitement de l'information ou Datamining ou économétrie ou informatique décisionnelle.



Cette opportunité est faite pour vous ? N'attendez plus pour postuler en nous adressant votre CV accompagné de quelques lignes sur votre projet professionnel et ce qui pourrait vous épanouir aujourd'hui. Ce sera la première étape de notre processus de recrutement.

Si vous n’êtes pas sûr(e) que cette offre soit LA bonne, d’autres postes sont à pourvoir, alors n’hésitez pas à consulter notre site carrière et/ou notre page Linkedin !",€45K - €65K (Employer est.),1 to 50 Employees,Company - Public,Insurance,Insurance Carriers,1998,$1 to $5 billion (USD),3.7
130,"EY
3.9",Consultant(e) / Manager - Data Analytics & Automatisation - FAAS - Lille - H/F,Lille,"EY est au cœur de la transformation et de la digitalisation de l’économie.

Les équipes Financial Accounting and Advisory Services (FAAS) d’EY accompagnent les directions financières pour répondre aux grands enjeux de la fonction finance : mesurer l’efficacité et la création de valeur des entreprises, accompagner dans la transformation digitale, être acteur de la stratégie de l’entreprise, participer à la politique d’investissement et de financement mais aussi optimiser les processus et améliorer le contrôle de la fonction finance.

EY propose un large éventail de services en matière de transformation de la fonction finance, de pilotage de la performance, de reporting consolidé, d’excellence comptable, de trésorerie, d’optimisation des processus financiers et de contrôle interne, et d’assistance comptable pour les transactions (acquisition, carve out, introduction en bourses, refinancement…)",€45K - €65K (Employer est.),Unknown,Unknown,-1,-1,-1,Unknown / Non-Applicable,3.9
131,"EY
3.9",Consultant Data Analyst Débutant F/H - Septembre 2022,Paris,"L’équipe Digital Hub est en charge de l’ensemble des projets digitaux pour les métiers de l’audit et du conseil financier. En position transversale, les domaines d’intervention de l’équipe sont très larges (industrie, secteur public, énergie, et retail, etc.) et le Digital Hub constitue le point d’entrée unique pour l'ensemble pour accompagner sur le terrains nos clients sur les thématiques de Transformation Digitale.
Notre objectif est également, par un effort permanent de formation et de qualification, d’être à la pointe de la technologie afin d’anticiper l’évolution du marché et les conséquences sur l’organisation de nos clients, leurs besoins et les éventuelles conséquences sur nos différents métiers. Localisée au sein du Lab EY à La Défense, espace de 600m² dédié à l’innovation autour du digital, de la data et du Cyber, l’équipe du Digital Hub fait partie de l’écosystème innovation en collaboration étroite avec les autres métiers du Conseil, du Juridique et de la transaction.
Vous serez intégré au sein d’une équipe de 20 personnes, gérée en mode start-up, dédiée à la mise en place de la transformation digitale des missions d’audit et de conseil financier.",€45K - €65K (Employer est.),Unknown,Unknown,-1,-1,-1,Unknown / Non-Applicable,3.9
132,"mediametrie
3.8",CDI - Data Analyst/Scientist F/H,Paris,"Descriptif de l'offre
Vous êtes passionné(e) par la Data Science et les innovations mathématiques, vous aimez analyser les données, les transformer en informations, développer de nouveaux algorithmes et résoudre des problèmes analytiques complexes ? Rejoignez notre Direction Data Science !
La Direction Data Science, composée de plus de 30 collaborateurs, intervient dans l’élaboration des études dès l’amont par la conception et la définition des méthodologies les plus adaptées et en aval par le traitement et l’analyse des données.
Votre environnement de travail :
Rattaché(e) au Directeur du Département Statistique et en collaboration avec l’équipe, vos missions seront les suivantes ;",€45K - €65K (Employer est.),501 to 1000 Employees,Company - Private,Media & Communication,Advertising & Public Relations,1985,Unknown / Non-Applicable,3.8
133,"Mirakl - French
4.1",Data Analyst,Paris,"Le secteur des marketplaces croît deux fois plus rapidement que l'ensemble du eCommerce. La mission de Mirakl est simple : nous aidons plus de 350+ clients à saisir cette opportunité en leur apportant la première solution SaaS de marketplace, une expertise inégalée et un écosystème de vendeurs et de partenaires pour accélérer le lancement et la croissance de leur marketplace.

Notre dernière levée de fonds de 555 millions de dollars en série E valorise Mirakl à plus de 3,5 milliards de dollars et nous place parmi les acteurs les plus dynamiques de l'eCommerce au niveau mondial.
Your impact:
The Business Intelligence team is the owner of customer data and insights at Mirakl, and acts as the main point of contact for anyone who needs insights about our customers, our products and the business as a whole.",€45K - €65K (Employer est.),501 to 1000 Employees,Company - Private,Information Technology,Enterprise Software & Network Solutions,2011,Unknown / Non-Applicable,4.1
134,"Insitoo
5.0",Data Scientist Sénior (H/F),Lyon,"Basée à Lille, Lyon, Nantes, Grenoble et Bruxelles, Insitoo Freelances est une société du groupe Insitoo, spécialisée dans le placement et le sourcing des Freelances IT et Métier. Depuis 2007, Insitoo Freelances a su s’imposer comme une référence en matière de freelancing par son expertise dans l’IT et ses valeurs de transparence et de proximité. Actuellement, afin de répondre aux besoins de nos clients, nous recherchons un Data Scientist Sénior (H/F) à Lyon, Auvergne-Rhône-Alpes, France.
Fonctionnement : Sur site à Lyon 50% + Télétravail 50%
Les missions attendues par le Data Scientist Sénior (H/F) sont :
Activité principale :",€45K - €65K (Employer est.),1 to 50 Employees,Company - Private,Human Resources & Staffing,Staffing & Subcontracting,2007,$25 to $100 million (USD),5.0
135,"Generali France
3.6",DATA SCIENTIST,Saint-Denis,"Date: 26 avr. 2023
Lieu de travail: ST DENIS, FR, 93200
Entreprise: GENERALI VIE
DATA SCIENTIST - H/F
Référence : 8953
CDI DUREE INDETERMINEE
Generali",€45K - €65K (Employer est.),10000+ Employees,Company - Public,Insurance,Insurance Carriers,1831,$10+ billion (USD),3.6
136,"Rubix
3.3",Data Analyst - Lyon,Lyon,"PRÉSENTATION DE L'ENTREPRISE
Rubix est leader européen de la distribution de produits et de solutions aux industriels.

Notre mission : faciliter l'industrie à nos clients en les accompagnant dans l'amélioration de leur performance économique, opérationnelle et environnementale. Pour cela, nous écoutons et analysons les besoins de chacun d'eux afin de proposer des produits et services adaptés, à forte valeur ajoutée, leur permettant de se concentrer pleinement sur leur coeur de métier.

Rubix en France, c'est la puissance d'un ancrage territorial et d'une expertise technique toujours plus innovante et performante, grâce à ses 200 agences et au savoir-faire de ses 2800 collaborateurs. La force de ce réseau, nous a permis de réaliser en 2021 un chiffre d'affaires de plus de 835 millions d'euros.

En rejoignant Rubix, vous intégrez un leader en forte croissance, qui propose de très belles perspectives aux talents entrepreneurs grâce à ses performances, son énergie, son dynamisme, et à sa culture à la fois exigeante et bienveillante.",€45K - €65K (Employer est.),5001 to 10000 Employees,Company - Private,-1,-1,-1,Unknown / Non-Applicable,3.3
137,"Cafeyn
4.5",Data Product Analyst,Paris,"We - Cafeyn Group
With more than 15 years of existence, Cafeyn Group is a multi-brand company composed of Cafeyn, Blendle, miLibris and Kidjo. Based in France, The Netherlands, UK, Canada and Morocco and almost 200 employees, we propose an innovative media experience through different products.
We want to achieve strong business performance across the Cafeyn Group through organic growth, diversified revenue streams and sustainable profitability. New opportunities are continuously sought by investment both within and outside of the business.
We deliver high-value, high-focus and forward-thinking, premium infotainment (information & entertainment content) services to our partners and customers, with personalised and relevant content to entertain and educate our audience, broadening their perspective and making them more knowledgeable.",€45K - €65K (Employer est.),51 to 200 Employees,Company - Private,Media & Communication,Broadcast Media,2007,Unknown / Non-Applicable,4.5
138,"Artefact
4.2",Data Scientist,Paris,"Who we are
Artefact is a new generation of a data service provider, specialising in data consulting and data-driven digital marketing, dedicated to transforming data into business impact across the entire value chain of organisations. We are proud to say we're enjoying skyrocketing growth.
Our broad range of data-driven solutions in data consulting and digital marketing are designed to meet our clients' specific needs, always conceived with a business-centric approach and delivered with tangible results. Our data-driven services are built upon the deep AI expertise we've acquired with our 1000+ client base around the globe.
We have 1000 employees across 20 offices who are focused on accelerating digital transformation. Thanks to a unique mix of company assets: State of the art data technologies, lean AI agile methodologies for fast delivery, and cohesive teams of the finest business consultants, data analysts, data scientists, data engineers, and digital experts, all dedicated to bringing extra value to every client.",€45K - €65K (Employer est.),501 to 1000 Employees,Company - Private,Management & Consulting,Business Consulting,2014,Unknown / Non-Applicable,4.2
139,"Akkodis
3.5",Ingénieur Data Scientist Junior H/F,Paris,"Dans le cadre du développement des activités digitales, notamment en lien avec la data, notre centre de compétences est à la recherche d’un(e) Data Scientist (H/F).
Vos missions
Vous serez amené(e) à travailler sur plusieurs projets et dans différents environnements techniques qui sont :
L’implémentation d’un outil de calcul automatique
La réalisation d’études statistiques
La prédiction de valeur en deep learning ou en machine learning
Du data mining",€45K - €65K (Employer est.),5001 to 10000 Employees,Subsidiary or Business Segment,Human Resources & Staffing,HR Consulting,1994,$1 to $5 billion (USD),3.5
140,"Moët Hennessy Wines & Spirits
3.8",Business Data Analyst,Paris,"Position
Your Mission is to support the Commercial Excellence Transformation journey of Moët Hennessy initiated in 2022, by providing business data and insights to the Revenue Growth Management and Merchandizing team.
As a member of the Commercial Excellence Team with a dual reporting line to both the RGM and Merchandizing Directors you will have a very transversal role, working with Maisons and Markets to define the best differentiated approach pursuing margin and growth instead of simply meeting customer demands.
In this exciting role you will:
Conduct data analysis, set objectives and develop tools related to a mix of RGM/Merchandizing levers like consumer pricing, customer pricing, promotions, trade terms, assortment mix etc.",€45K - €65K (Employer est.),1001 to 5000 Employees,Subsidiary or Business Segment,Manufacturing,Food & Beverage Manufacturing,1765,$100 to $500 million (USD),3.8
141,"Nexton Consulting FR
3.8",Business Analyst Data H/F,Paris,"Description de l'offre

NEXTON recrute un BUSINESS ANALYST DATA H/F , en CDI , à Paris !

Qui sommes-nous ?
NEXTON c’est avant tout une entreprise qui accompagne ses clients dans leur transformation digitale. Tous les jours, nous travaillons avec des grands comptes et des pures players (SNCF, Orange, BNP PARIBAS…).
Nous sommes experts du digital aussi bien sur de l’accompagnement stratégique qu’opérationnel.
Fort du succès, NEXTON connaît aujourd’hui un développement significatif, autour de ses valeurs piliers : cohésion, confiance et performance.
Et pour toi ? Notre politique de développement des compétences dynamique saura te séduire avec un programme de suivi de carrière sur-mesure.

Le contexte :
Au sein d'un de nos clients grands comptes, leader de la transition énergétique en France, nous recherchons un Business Analyst orienté Data.
Tu joues un rôle essentiel en tant qu'intermédiaire incontournable entre les équipes opérationnelles et le département informatique. Cela implique notamment la compétence d'analyse des exigences des différents métiers, afin de formaliser de manière précise les cahiers des charges ou les spécifications, en veillant à les rendre aussi fidèles que possible aux besoins exprimés.


Dans le cadre d'un applicatif Data (API, ETL, interface avec mobile/web...), tu as la responsabilité de :
Recueillir les besoins et rédiger les US technico -fonctionnelles,
Valider les règles de gestion,
Analyser et résoudre les cas clients de production, dans le cadre de la MCO (Maintenance en condition opérationnelle),
Proposer des évolutions d’amélioration des fonctionnalités existantes,
Participer aux différents ateliers métiers,
Suivre l’avancement des développements des US,
Travailler de concert avec les autres membres de l’équipes (Data Engineer, testeur, datascientist…).",€45K - €65K (Employer est.),201 to 500 Employees,Company - Private,Management & Consulting,Business Consulting,2011,$25 to $100 million (USD),3.8
142,"Air France-KLM
4.1",DATA ANALYST SUPPLY CHAIN H/F,Roissy-en-France,"La mission s'articule autour de deux axes principaux:
Construction d'outils de visualisation de données :
Ces outils devront être adaptés aux besoins des différents acteurs Ils auront vocation à permettre une mise en lumière des points forts et des axes d'amélioration de chaque tronçon de la Supply Chain. L'exploitation pourra se faire de la maille la plus fine (pilotage opérationnel) à la maille la plus large (Analyse des tendances sur le trimestre, l'année et au-delà).
Le/la titulaire du poste devra à ce titre participer à la conception des outils, en relation avec les opérationnels et les services en charge de la gestion de la donnée.

Analyse de données :
La réelle valeur ajoutée du poste (et du service Animation de la Supply Chain) réside dans la capacité à « faire parler la donnée ». Une fois les outils de mesure et les rituels d'animation mis en place, le titulaire devra analyser les tendances, les corrélations sur les flux en écart par rapport à la moyenne. Cette analyse devra se faire sur la base des données recueillies d'une part, sur la base d'une bonne connaissance des données source et de leur fiabilité d'autre part et enfin (et surtout) sur la base d'une connaissance des métiers et modes de fonctionnement de la Supply Chain.",€45K - €65K (Employer est.),10000+ Employees,Company - Private,Transportation & Logistics,"Airlines, Airports & Air Transportation",1933,$5 to $10 billion (USD),4.1
143,"NEO SOFT
4.0",Data Analyst H/F,Lyon,"time type
Temps plein
posted on
Offre publiée il y a 30 jours ou plus
job requisition id
JR100455
Qui sommes-nous?
Fédérateur de talents au service de l'excellence digitale, Néo-Soft est un Groupe indépendant de conseil en transformation digitale. Reconnu pour l’expertise de ses 1 700 consultants et ses 15 implantations dans 4 pays, nous sommes spécialisés dans 5 domaines d'expertise : - Conseil & Gestion de projet - Domaine applicatif - Systèmes & Réseaux - Cybersécurité grâce notre filiale dédiée Cogital - Data Une offre diversifiée pour accompagner nos clients tout au long de leurs projets. Animés par une forte exigence sociétale et engagés sur les enjeux environnementaux, nous nous mobilisons au quotidien pour le bien-être de nos consultants, une démarche récompensée par le label Engagé RSE et l’obtention du label Happy At Work depuis 4 ans.",€45K - €65K (Employer est.),1001 to 5000 Employees,Company - Private,Information Technology,Information Technology Support Services,2005,$25 to $100 million (USD),4.0
144,"E.Leclerc
3.0",Data Analyst - H/F,Ivry-sur-Seine,"Mieux nous connaître
Le Mouvement E.LECLERC est un groupement coopératif dont les adhérents sont les propriétaires de magasins, soit 592 entrepreneurs, dont Michel-Edouard Leclerc est le porte-parole. Le Mouvement E.leclerc compte 133 000 collaborateurs, qui travaillent collectivement à la réussite de nos 721 magasins (hypers, supers et express), 690 Drives et 2 541 enseignes spécialisées.
L COMMERCE est l’entité digitale du Mouvement E. LECLERC. L COMMERCE conjugue les talents d’une équipe de 100 collaborateurs répartis au sein des différents Pôles tels que le Marketing Digital, le Commercial, les Opérations, les Technologies et la Finance. Ensemble, ils animent au quotidien notre site marchand www.e.leclerc.
Une start up au cœur du Mouvement !
Descriptif de l'offre",€45K - €65K (Employer est.),10000+ Employees,Company - Private,Retail & Wholesale,Vehicle Dealers,-1,Unknown / Non-Applicable,3.0
145,"Pennylane
4.9",Data Analyst (remote),Paris,"Are you looking to have an impact on the daily life of millions of entrepreneurs in France and Europe?
Do you thrive in a trustful, fast-paced environment?
Do you feel like our Engineering principles are aligned with your vision?

Then Pennylane might be the right place for you — and you, might be the perfect fit for this role

Our vision

We aim to become the most beloved financial Operating System of European SMEs.
We help business owners get rid of the time consuming hassle of handling accounting and finance, while giving them access to key information that they can use to make better decisions.

Meanwhile, we’re helping accountants. By using Pennylane, rather than doing manual and repetitive tasks, they can spend more time advising and guiding their clients.",€45K - €65K (Employer est.),201 to 500 Employees,Company - Private,Information Technology,Software Development,2020,Unknown / Non-Applicable,4.9
146,"Groupe Rocher
3.5",Data Scientist Projets,Issy-les-Moulineaux,"Réf: 107076

Lieu:
FR - Issy-les-Moulineaux, FR

Type de contrat: CDI / Unlimited Term
Marque: Yves Rocher
Equipe: Direction Customer Experience Transformation
Data Scientist Projets

Voulez-vous faire partie d’une entreprise à mission qui reconnecte les femmes & les hommes à la Nature ?

Prêt(e) à découvrir une nouvelle opportunité au sein du Groupe Rocher ?

Rejoignez la marque Yves Rocher ! De la plante à la peau, nous maîtrisons l’ensemble du cycle de vie de nos produits. Devenir salarié Yves Rocher, c’est faire partie d’un réseau de personnes passionnées et positives, engagées dans la protection de la biodiversité tout en servant avec excellence tous nos consommateurs.

Poste basé à Issy-les-Moulineaux - Société LBV

Le monde change, se transforme et Yves Rocher s’inscrit pleinement dans cette évolution. Au sein de l’équipe Data for Business, venez écrire une nouvelle page de son histoire !


Vous voulez être un acteur de la data, vous savez tout ce que la data peut apporter et voulez contribuer à la création d’une nouvelle équipe focussée sur le business, c’est pourquoi :

Vous mettez en œuvre nos référentiels clients et assurez la bonne synchronisation de celui-ci avec tous nos outils (site internet, caisse magasin, back-offices)
Vous utilisez ce référentiel pour améliorer notre connaissance cliente grâce à des études utilisant l’ensemble de nos canaux de vente et de contacts
Vous garantissez la qualité de nos data nous permettant une relation parfaite avec nos clientes
Vous améliorez la qualité de nos données via la mise en place d’outils de déduplication clientes et d’enrichissement de données
Vous travaillez main dans la main avec les Equipes Centrales de la marque en cas de dysfonctionnement des outils data et vérifiez l’adéquation de la solution apportée


Vous avez une bonne connaissance de SQL et Python.
Vous avez une première expérience en Data Science/Data Engineering dans un environnement Big Data
Vous avez une bonne pratique de l’anglais vous permettant d’évoluer dans un contexte international
Vous aimez les responsabilités et voulez être notre référent qualité de la donnée
Vous travaillez avec efficacité avec d’autres services, même non expert, et êtes notre ambassadeur pour améliorer nos process
avec vous, nos problèmes trouvent une solution !

Prêt à faire bouger les lignes avec nous ? N’attendez plus et postulez !

Le Groupe Rocher accueille tous les talents et analyse chaque candidature avec la même attention sans distinction de genre, d’orientation sexuelle, d’âge, de culture, ou de handicap.

Comme pour la Nature, nous sommes convaincus que la diversité est une force pour nos entreprises.

https://groupe-rocher.com/nos-valeurs",€45K - €65K (Employer est.),10000+ Employees,Private Practice / Firm,Retail & Wholesale,Beauty & Personal Accessories Stores,1959,$1 to $5 billion (USD),3.5
